{
  "$schema": "../schemas/boldcreate-marketplace.schema.json",
  "name": "boldcreate-plugins",
  "owner": {
    "name": "Syncfusion"
  },
  "metadata": {
    "description": "Reviewed AI-agent plugins for BoldCreate Connect: remote MCP servers developers use every day, a toolkit for the whole software delivery lifecycle, Syncfusion component skills, and community skill and agent packs.",
    "formatVersion": 1
  },
  "plugins": [
    {
      "name": "advisor",
      "displayName": "Advisor",
      "version": "1.0.0",
      "description": "Consult a stronger model at key checkpoints: before major decisions, when stuck on an error, and before declaring a task done. The advisor gets a full briefing plus the conversation transcript, returns guidance, and the main model keeps doing the work.",
      "source": "third_party/advisor",
      "logo": "third_party/advisor/assets/avatar.png",
      "category": "developer-tools",
      "components": [
        "skills",
        "hooks",
        "agents"
      ],
      "transports": [],
      "auth": [],
      "requiresSecrets": false,
      "rollout": {
        "phase": 1
      },
      "supportedByGateway": false
    },
    {
      "name": "agent-compatibility",
      "displayName": "Agent Compatibility",
      "version": "1.0.0",
      "description": "CLI-backed repo compatibility scans plus agents that audit startup, validation, and docs against reality.",
      "source": "third_party/agent-compatibility",
      "logo": "third_party/agent-compatibility/assets/avatar.png",
      "category": "developer-tools",
      "components": [
        "skills",
        "agents"
      ],
      "transports": [],
      "auth": [],
      "requiresSecrets": false,
      "rollout": {
        "phase": 1
      },
      "supportedByGateway": false
    },
    {
      "name": "android-management",
      "displayName": "Android Management",
      "version": "0.7.0",
      "description": "Manage enterprise Android devices, policies, and apps with the Android Management API.",
      "source": "third_party/android-management",
      "logo": "third_party/android-management/assets/logo.svg",
      "category": "devices",
      "components": [
        "mcp"
      ],
      "transports": [
        "streamable-http"
      ],
      "auth": [
        "oauth"
      ],
      "requiresSecrets": true,
      "rollout": {
        "phase": 2,
        "wave": "B"
      },
      "supportedByGateway": true
    },
    {
      "name": "atlassian",
      "displayName": "Atlassian (Jira + Confluence)",
      "version": "0.7.0",
      "description": "Search and update Jira issues and Confluence pages.",
      "source": "third_party/atlassian",
      "logo": "third_party/atlassian/assets/logo.svg",
      "category": "project-management",
      "components": [
        "mcp"
      ],
      "transports": [
        "streamable-http"
      ],
      "auth": [
        "oauth"
      ],
      "requiresSecrets": false,
      "rollout": {
        "phase": 1,
        "wave": "B"
      },
      "supportedByGateway": true
    },
    {
      "name": "aws-knowledge",
      "displayName": "AWS Knowledge",
      "version": "0.7.0",
      "description": "Search AWS documentation, API references, and regional availability.",
      "source": "third_party/aws-knowledge",
      "logo": "third_party/aws-knowledge/assets/logo.svg",
      "category": "documentation",
      "components": [
        "mcp"
      ],
      "transports": [
        "streamable-http"
      ],
      "auth": [
        "none"
      ],
      "requiresSecrets": false,
      "rollout": {
        "phase": 1,
        "wave": "A"
      },
      "supportedByGateway": true
    },
    {
      "name": "boldcreate-toolkit",
      "displayName": "BoldCreate Toolkit",
      "version": "0.7.1",
      "description": "Skills, reviewer agents and rules that take any project from idea to release: specs, test-first builds, two-axis code review and pull requests.",
      "source": "boldcreate-toolkit",
      "logo": "boldcreate-toolkit/assets/logo.png",
      "category": "developer-tools",
      "components": [
        "skills",
        "rules",
        "hooks",
        "agents"
      ],
      "transports": [],
      "auth": [],
      "requiresSecrets": false,
      "rollout": {
        "phase": 1
      },
      "supportedByGateway": false
    },
    {
      "name": "cli-for-agent",
      "displayName": "CLI for Agents",
      "version": "1.0.0",
      "description": "Patterns for designing CLIs that coding agents can run reliably: non-interactive flags, layered help with examples, pipelines, actionable errors, idempotency, and dry-run.",
      "source": "third_party/cli-for-agent",
      "logo": "third_party/cli-for-agent/assets/logo.svg",
      "category": "developer-tools",
      "components": [
        "skills"
      ],
      "transports": [],
      "auth": [],
      "requiresSecrets": false,
      "rollout": {
        "phase": 1
      },
      "supportedByGateway": false
    },
    {
      "name": "context7",
      "displayName": "Context7",
      "version": "0.7.1",
      "description": "Pull up-to-date, version-specific library docs and code examples into the prompt.",
      "source": "third_party/context7",
      "logo": "third_party/context7/assets/logo.svg",
      "category": "documentation",
      "components": [
        "mcp"
      ],
      "transports": [
        "streamable-http"
      ],
      "auth": [
        "oauth"
      ],
      "requiresSecrets": false,
      "rollout": {
        "phase": 1,
        "wave": "A"
      },
      "supportedByGateway": true
    },
    {
      "name": "continual-learning",
      "displayName": "Continual Learning",
      "version": "1.0.0",
      "description": "Incrementally learns durable user preferences and workspace facts from transcript changes and keeps AGENTS.md up to date with plain bullet points.",
      "source": "third_party/continual-learning",
      "logo": "third_party/continual-learning/assets/avatar.png",
      "category": "developer-tools",
      "components": [
        "skills",
        "hooks",
        "agents"
      ],
      "transports": [],
      "auth": [],
      "requiresSecrets": false,
      "rollout": {
        "phase": 1
      },
      "supportedByGateway": false
    },
    {
      "name": "create-plugin",
      "displayName": "Create Plugin",
      "version": "1.0.0",
      "description": "Scaffold and validate new agent plugins. Handles directory setup, manifest generation, and pre-submission quality checks for the marketplace.",
      "source": "third_party/create-plugin",
      "logo": "third_party/create-plugin/assets/avatar.png",
      "category": "developer-tools",
      "components": [
        "skills",
        "rules",
        "agents"
      ],
      "transports": [],
      "auth": [],
      "requiresSecrets": false,
      "rollout": {
        "phase": 1
      },
      "supportedByGateway": false
    },
    {
      "name": "deepwiki",
      "displayName": "DeepWiki",
      "version": "0.7.0",
      "description": "Ask questions about any public GitHub repository and read its generated wiki.",
      "source": "third_party/deepwiki",
      "logo": "third_party/deepwiki/assets/logo.svg",
      "category": "documentation",
      "components": [
        "mcp"
      ],
      "transports": [
        "streamable-http"
      ],
      "auth": [
        "none"
      ],
      "requiresSecrets": false,
      "rollout": {
        "phase": 1,
        "wave": "A"
      },
      "supportedByGateway": true
    },
    {
      "name": "dyl-stack",
      "displayName": "dyl-stack",
      "version": "0.1.0",
      "description": "Dylan's agent style on top of pstack: root causes over symptom patches, The Algorithm before design, terse verified delivery, a PR review that fits in a paste, and Figma-to-UI with a visual judge.",
      "source": "third_party/dyl-stack",
      "logo": "third_party/dyl-stack/assets/logo.png",
      "category": "developer-tools",
      "components": [
        "skills",
        "agents"
      ],
      "transports": [],
      "auth": [],
      "requiresSecrets": false,
      "rollout": {
        "phase": 1
      },
      "supportedByGateway": false
    },
    {
      "name": "figma",
      "displayName": "Figma",
      "version": "0.7.0",
      "description": "Turn Figma frames into code and read design tokens, components, and variables.",
      "source": "third_party/figma",
      "logo": "third_party/figma/assets/logo.svg",
      "category": "design",
      "components": [
        "mcp"
      ],
      "transports": [
        "streamable-http"
      ],
      "auth": [
        "oauth"
      ],
      "requiresSecrets": false,
      "rollout": {
        "phase": 1,
        "wave": "B"
      },
      "supportedByGateway": true
    },
    {
      "name": "gitea",
      "displayName": "Gitea",
      "version": "0.7.0",
      "description": "Work with Gitea repositories, issues, pull requests, and releases through your own gitea-mcp server.",
      "source": "third_party/gitea",
      "logo": "third_party/gitea/assets/logo.svg",
      "category": "source-control",
      "components": [
        "mcp"
      ],
      "transports": [
        "streamable-http"
      ],
      "auth": [
        "bearer"
      ],
      "requiresSecrets": true,
      "rollout": {
        "phase": 2,
        "wave": "A"
      },
      "supportedByGateway": true
    },
    {
      "name": "github",
      "displayName": "GitHub",
      "version": "0.7.0",
      "description": "Manage repos, issues, pull requests, and Actions.",
      "source": "third_party/github",
      "logo": "third_party/github/assets/logo.svg",
      "category": "source-control",
      "components": [
        "mcp"
      ],
      "transports": [
        "streamable-http"
      ],
      "auth": [
        "bearer"
      ],
      "requiresSecrets": true,
      "rollout": {
        "phase": 1,
        "wave": "A"
      },
      "supportedByGateway": true
    },
    {